{
  "$ref": "#/definitions/governance",
  "definitions": {
    "governance": {
      "type": "object",
      "properties": {
        "name": {
          "type": "string"
        },
        "country": {
          "type": "string"
        },
        "role": {
          "type": "string"
        },
        "bio": {
          "type": "string"
        },
        "photo": {
          "type": "string"
        },
        "order": {
          "type": "number",
          "default": 99
        },
        "active": {
          "type": "boolean",
          "default": true
        },
        "sourceUrl": {
          "type": "string"
        },
        "$schema": {
          "type": "string"
        }
      },
      "required": [
        "name",
        "country",
        "role"
      ],
      "additionalProperties": false
    }
  },
  "$schema": "http://json-schema.org/draft-07/schema#"
}