{
  "name": "Prof. Sarah Jenkins",
  "country": "United Kingdom",
  "role": "Trustee & Scientific Advisory Lead",
  "bio": "Professor of Structural Bioinformatics.",
  "photo": "/images/governance/sarah-jenkins.jpg",
  "order": 2,
  "active": true,
  "sourceUrl": "https://www.ukabcs.co.uk/governance-leadership-1"
}
