{
  "name": "Dr. Alexander Wright",
  "country": "United Kingdom",
  "role": "Chair of the Board of Trustees",
  "bio": "Senior Researcher in Computational Biology with 20+ years of academic leadership.",
  "photo": "/images/governance/alexander-wright.jpg",
  "order": 1,
  "active": true,
  "sourceUrl": "https://www.ukabcs.co.uk/governance-leadership-1"
}
